Konsulentrolle,Rollekategori,Kompetansekrav,Erfaringskrav,Konsulentegenskaper,Kundenavn,Bransje,Årstall
"Prosessleder til prosjekt grunndata og tillitstjenester, inkl API-management",Prosessledelse og fasilitering,"Minimum 5 års relevant arbeidserfaring som prosjektleder for store og komplekse IKT prosjekter i offentlig sektor/store organisasjoner. Dokumentert erfaring som støtte til prosjekteier/mottaksprosjektleder. Kompetanse om metoder og rammeverk innen prosjektledelse og programstyring. Sertifisering som prosjektleder (Prince 2 eller tilsvarende). Dokumentert erfaring fra arbeid i programkontor. Dokumentert erfaring med endringsledelse, gevinststyring og interessenthåndtering. Dokumentert erfaring fra helse- og omsorgssektoren.","Minimum 5 års relevant arbeidserfaring som prosjektleder for store og komplekse IKT prosjekter i offentlig sektor/store organisasjoner. Dokumentert erfaring med endringsledelse, gevinststyring og interessenthåndtering.",Gode leder- og samarbeidsegenskaper.,Direktoratet for e-helse,Helse,2021
Kvalitetssikring Økonomistyringsprosjektet,Offentlig kvalitetssikring,"Erfaring fra tilsvarende arbeid med kvalitetssikring av større prosjekter. God metodisk og prosessuell forståelse. Operativ ressurs med kompetanse og erfaring innen prosessledelse, prosessanalyser og – kartlegging. Sertifisering innen prosjektmetodikk PRINCE2 eller lignende, god kjennskap til DIFIs prosjektveiviser.",Erfaring fra tilsvarende arbeid med kvalitetssikring av større prosjekter. Erfaring fra oppdrag for statlig virksomheter.,Gode skriftlig- og muntlig fremstillingsevne. Gode samarbeidsevner og kommunikasjonsevner.,Statens vegvesen,Offentlig og stat,2021
Standardisering av arbeidsprosesser for økonomistyring,Prosessledelse og fasilitering,"Operativ ressurs med kompetanse og erfaring innen prosessledelse, prosessanalyser og– kartlegging. God metodisk og prosessuell forståelse. Erfaringskrav innen tilsvarende arbeid. God systemforståelse.",Erfaring fra tilsvarende arbeid. Erfaring fra oppdrag for statlig virksomheter.,God skriftlig- og muntlig fremstillingsevne. Gode samarbeidsevner og kommunikasjonsevner. Høy arbeidskapasitet.,Statens vegvesen,Offentlig og stat,2021
Evaluering av Medfinansieringsordningen for digitaliseringsprosjekter,Rådgivning forretning,Relevant lang erfaring og fagbakgrunn med metodeerfaring innen styring og organisering i offentlige virksomheter.,"Involvert i en rekke utredninger, evalueringer og prosjekter knyttet til virksomhetsstyring, digitalisering, organisasjonsutvikling mv.","God forståelse for problemstillinger, treffer godt på problematisering av insentivstruktur og roller.",Kommunal- og moderniseringsdepartementet,Offentlig og stat,2021
Kvalitetssikring av prosjekter,Offentlig kvalitetssikring,Kunnskap om Finansdepartementets kvalitetssikringsregime,"Erfaring fra kvalitetssikring med Statsbygg, KS, Nye Veier, Avinor, Bane NOR",Tilpasningsdyktig i metoder og arbeidsomfang,Politiets fellestjenester,Offentlig og stat,2021
Strategiutvikling,Strategiutvikling og implementering,Bruk av modeller som 'Offentlig strategiprosess' og OECDs organisasjonsanalyse,Erfaring med strategiske analyser i offentlige organisasjoner,Evne til å bruke strategiske analyser og rammeverk tilpasset offentlige sektorer,Politiets fellestjenester,Offentlig og stat,2021
Økonomi- og virksomhetsstyring,Økonomi og analyse,"Kunnskap om mål- og resultatstyring, porteføljestyring",Erfaring med DFØs rammeverk for virksomhetsstyring,Tydeleghet rundt roller og ansvar i styringsprosesser,Politiets fellestjenester,Offentlig og stat,2021
Analyse og utredning,Rådgivning forretning,"Kompetanse innen samfunnsøkonomiske analyser som kost-nytteanalyser, inveseringsanalyser",Erfaring med konseptutredninger i tråd med Statens prosjektmodell,Analytisk med evne til å bearbeide og utarbeide løsningsforslag,Politiets fellestjenester,Offentlig og stat,2021
Prosessleder for Prosjekt Helsedata,Prosessledelse og fasilitering,,,,Direktoratet for e-helse,Helse,2021
Støtte enhet for økonomi- og virksomhetsstyring i implementering av eierstyringsmodell,Rådgivning teknisk,"Konsulenten må ha god kunnskap og erfaring fra ledelse/styring av IKT-prosjekter, både agile utviklingsprosjekter og prosjekter basert på tradisjonell 'fossefalltilnærming'. Konsulenten må ha god kunnskap og erfaring fra etablering av hensiktsmessig prosjektstrategi og -organisasjon. Konsulenten må ha god kunnskap om statens prosjektmodell og Prosjektveiviseren. Konsulenten må kunne vise til praktisk erfaring fra kvalitetssikring av utviklings-/digitaliseringsprosjekter. Konsulenten må ha god kunnskap om eierstyring av utviklings-/digitaliseringsprosjekter. Konsulenten må ha god kunnskap om porteføljerapportering. Konsulenten må ha erfaring med etablering og implementering av eierstyringsmodeller for utviklings-/digitaliseringsprosjekter i statlig sektor.","Konsulenten må ha erfaring med operativ rådgivning i porteføljestyring, utredninger og kvalitetssikring i regi av statlig sektor, inkludert NAV, Helse Sør-Øst og Direktoratet for e-helse.","Konsulenten må ha god skriftlig- og muntlig fremstillingsevne, gode samarbeidsevner og kommunikasjonsevner, og kunne kommunisere godt med ledere så vel som teknologer.",Statens vegvesen,Offentlig og stat,2021
Prosjektleder for prosjektet Utvikling av Simuleringssenteret ved Oslo universitetssykehus HF,Prosjektledelse,"Utdannelse på bachelor/masternivå, operativ erfaring fra prosjektledelse innen strategi- og virksomhetsutvikling, PRINCE2-sertifisering","Erfaring med endringsledelse, prosessledelse og -kartlegging, erfaring fra helse- eller undervisningssektoren","God virksomhetsforståelse, bred operativ erfaring, evne til å håndtere prosjektets interessenter, forankringsarbeid",Helse Sør-Øst RHF,Helse,2021
Evaluering av arbeidet med automatisering av saksbehandling i UDI,Ingen,,,,Utlendingsdirektoratet - UDI,Offentlig og stat,2022
Programstøtte for strategisk program Forutsigbar Fremkommelighet,Programledelse,"Kjennskap til programstyring i offentlig sektor, erfaring innen strategiarbeid og målstyring, god forståelse for tverrfaglige produktteam, kunnskap om Statens vegvesen sitt arbeid med måleindikatorer og virksomhetsstrategi.","Erfaring med gjennomføring av store statlige program og utviklingsprosjekter, erfaring med etablering av team og områder.","God skriftlig- og muntlig fremstillingsevne, gode samarbeidsevner og kommunikasjonsevner, smidig tankesett.",Statens vegvesen,Offentlig og stat,2021
Oppdragsansvarlig og operativ prosjektleder,Prosjektledelse,"Kunnskap om digitaliseringsstrategi, prosjektstyring av digitaliseringsprosjekter, og effektivitetsvurdering av teknologi","Bred erfaring fra prosjektledelse og IKT-ledelse, kvalitetssikring og strategisk bruk av IKT",Meget erfaren konsulent med strukturert og fleksibel arbeidsmetode,Kommunal- og moderniseringsdepartementet,Offentlig og stat,2021
Prosjektmedarbeider og analytiker,Økonomi og analyse,"Forvaltningsrevisjon, evaluering, utredning og analyse, dataanalyse",Erfaring fra Riksrevisjonen med ledelse av forvaltningsrevisjoner og fra revisjon på kommunalt nivå,"God analytisk evne, strukturert og med høy grad av presisjon",Kommunal- og moderniseringsdepartementet,Offentlig og stat,2021
Teknisk ressurs,Løsningsarkitektur,Teknisk kompetanse om drift og forvaltning av IT-tjenester,Erfaring fra prosjekter knyttet til drift og vedlikehold av IT-tjenester,Kompletterende kompetanse og god evne til samarbeid,Kommunal- og moderniseringsdepartementet,Offentlig og stat,2021
Partner,Rådgivning teknisk,"IKT i offentlig sektor, digital transformasjon",Lang erfaring innen teknisk rådgivning og kvalitetssikring,Sterk fagkompetanse og inngående forståelse for digital transformasjon,Kommunal- og moderniseringsdepartementet,Offentlig og stat,2021
Styring og Organisering,Programledelse,"Må ha relevant sertifisering i prosjekt- og programmetodikk (f.eks. MSP sertifisering, Prince2 eller tilsvarende)",Minimum 3 års erfaring som prosjektmedarbeider i prosjekter,"Gode formidlingsevner, både skriftlig og muntlig.",Direktoratet for e-helse,Helse,2021
Gjennomføringsstrategi,Programledelse,Erfaring fra prosjektarbeid knyttet til å utarbeide strategier for gjennomføring,Minimum 5 års erfaring fra prosjektarbeid,"Gode formidlingsevner, både skriftlig og muntlig.",Direktoratet for e-helse,Helse,2021
"Rådgiver, lege for pasientens legemiddelliste",Rådgivning teknisk,Min. 5 års erfaring som praktiserende lege. Min. 5 års ledererfaring fra helsetjenesten.,Erfaring fra kommunehelsetjenesten inkl. fastlege. Erfaring med prosjektstyringsdokumentasjon. Erfaring med innføring av e-helseløsninger generelt og e-resept spesielt.,,Direktoratet for e-helse,Helse,2021
Prosjekt- og prosessleder for Nasjonal styringsmodell,Prosessledelse og fasilitering,"Relevant utdanning på universitets-/høyskolenivå, minimum på masternivå. God kjennskap til statlig styring, utvikling og implementering av styrings-, organisasjons- og finansieringsmodeller, helst på nasjonalt nivå på tvers av statlig og kommunal sektor. God kjennskap til prosessledelse, inkludert aktivitetsplanlegging, interessentkontakt og fasilitering av møter og workshops. God kompetanse og erfaring når det gjelder fremstille/visualisere ideer, figurer/modeller, mål og strategier. God kompetanse på utarbeidelse og utvikling av presentasjoner. God muntlig og skriftlig formuleringevne.","Erfaring fra tilsvarende utviklingsarbeid basert på beste praksis metodikk, erfaring fra å drive gode prosesser, involvering og forankring gjennom workshops, koordinering av innspillsrunder. Erfaring i å utarbeide referater, fremstille/visualisere ideer, figurer/modeller, mål og strategier, og utvikling av presentasjoner.","Kunne uttrykke seg meget godt skriftlig, være leveranseorientert, effektiv, lyttende og samarbeidsorientert, systematisk og strukturert arbeidsform.",Direktoratet for e-helse,Helse,2021
Usikkerhetsanalytiker for Forprosjektet steg 2 program digital samhandling,Økonomi og analyse,Kjennskap til og erfaring med bruk av relevante verktøy og metodeverk for usikkerhetsanalyse. Erfaring med estimering og usikkerhetsanalyse av store prosjekter.,Erfaring fra prosjekter underlagt KS-ordningen. Erfaring med å drive/lede arbeidsprosessen i samarbeid med nødvendige interessenter.,"Gruppeprosessledelse, involvering av prosjektets ressurser, ekspertkompetanse på arbeidsomfang og tilnærming.",Direktoratet for e-helse,Helse,2021
Usikkerhetsanalytiker for digital samhandling,Rådgivning teknisk,Kjennskap til og erfaring med bruk av relevante verktøy og metodeverk for usikkerhetsanalyse,Erfaring med estimering og usikkerhetsanalyse av store prosjekter og vise til eksempler på leveranser fra tidligere prosjekter hvor liknende arbeid har blitt utført,,Direktoratet for e-helse,Helse,2021
Anskaffelsesrådgiver for administrative kategorier,Rådgivning forretning,"Relevant høyere utdanning innen jus, innkjøp, økonomiske fag e.l. Juridisk utdannelse teller særlig positivt. Erfaring med gjennomføring av anskaffelser ihht Lov og forskrift om offentlige anskaffelser, klassisk sektor. God erfaring med Statens Standardavtaler (SSA) Minst 3 års erfaring med offentlige anskaffelser Erfaring med administrative anskaffelser Erfaring med tjenesteanskaffelser Erfaring med kontraktsoppfølging Det vil vektes positivt om kandidaten har erfaring med oppfølging av eiendomskontrakter","Erfaring med operativ gjennomføring av anskaffelser i ulike størrelser, omfang og kompleksitet","Strukturert, men fleksibel tilnærming til oppgavene",Spordrift AS,Offentlig og stat,2021
Senior prosjektleder/prosessleder - Konsulent 1,Prosjektledelse,"God arkitektur- og utredningskompetanse, kompetanse på offentlige innkjøpsprosesser, teknologisk/teknisk kommunikasjonserfaring, arkitekturkunnskap","Erfaring fra tilsvarende arbeid og helsesektoren, erfaring fra større omstillinger i felles tjenestesentre i den offentlige helsesektoren, erfaring innen helsesektoren, spesielt akuttmedisinske kjeden","Selvstendig, stor gjennomføringsevne, gode samarbeids- og kommunikasjonsevner, løsnings- og resultatorienterte, fleksible og endringsvillige",Helsetjenestens driftsorganisasjon for nødnett HF,Helse,2022
Senior prosjektleder/prosessleder - Konsulent 2,Lede agilt team,"God arkitektur- og utredningskompetanse, kompetanse på offentlige innkjøpsprosesser, merkantil erfaring fra offentlig innkjøpsprosesser, rutiner og prosesser, prosjekt og prosessledelse","Erfaring fra tilsvarende arbeid og helsesektoren, erfaring fra større omstillinger i felles tjenestesentre i den offentlige helsesektoren, erfaring innen helsesektoren, spesielt akuttmedisinske kjeden","Selvstendig, stor gjennomføringsevne, gode samarbeids- og kommunikasjonsevner, løsnings- og resultatorienterte, fleksible og endringsvillige",Helsetjenestens driftsorganisasjon for nødnett HF,Helse,2022
Prosjektleder/Sekretariat regionalt arkitekturråd og interregionalt arkitekturutvalg,Prosjektledelse,Spesialist: prosjekt- og prosessledelse. Dokumentert prosjekt- og prosesslederkompetanse og erfaring. Erfaring med arbeid i store virksomheter.,Erfaring med ledelse av saksbehandlingsprosesser i store offentlige virksomheter. Erfaring fra helsesektoren.,"God kommunikasjon, skriftlig og muntlig. Leveranseorientert, prosessdriver. Strukturert, systematisk. Selvstendig, proaktiv. Lagspiller. Ydmyk.",Helse Sør-Øst RHF,Helse,2022
Lederstøtte,Produkt- og tjenesteansvar,Høyere teknisk utdannelse på minimum bachelor nivå. Gode skriftlig og muntlig kommunikasjonsferdigheter (Norsk og Engelsk). Kjennskap til smidige (agile) metoder. Kjennskap til Prince@2. Erfaring som prosess eller prosjektleder. Kjennskap til helsesektoren og/eller Nødnett vil være en fordel. Gjerne erfaring fra prosessorientert arbeid / ITIL. Gjerne erfaring med kontinuerlig produktutvikling i tverrfaglige team.,Kjennskap til smidige (agile) metoder. Erfaring som prosess eller prosjektleder. Kjennskap til Prince2. Kjennskap til helsesektoren og/eller Nødnett.,Stor interesse for digitale kommunikasjonsløsninger. Aktiv bidragsyter i HDO tjenesteportefølje. Pådriver i HDO til å levere nye tjenester til eksisterende og nye kunder.,Helsetjenestens driftsorganisasjon for nødnett HF,Helse,2022
Rådgiver/lederstøtte med interesse for digitale kommunikasjonsløsninger,Kurs og opplæring,Stor interesse for digitale kommunikasjonsløsninger,,"Kreativ, teknologiforståelse, liker tverrfaglig arbeid",Helsetjenestens driftsorganisasjon for nødnett HF,Helse,2022
Prosjektstøtte i prosjekt for anskaffelse av løsning for medialogg,Prosjektledelse,"God kunnskap innen informasjons- og kommunikasjonsteknologi. God kjennskap til, og erfaring i arbeid med risikoanalyser og informasjonssikkerhet. Erfaring i offentlige anskaffelsesprosesser for tjenester og driftsløsninger. Erfaring innen prosjektarbeid i større organisasjoner. Erfaring fra IT-basert virksomhet.","Lang erfaring som offiser med spesialisering innen IKT-drift fra 1996 i Hærens samband og Cyberforsvaret. Erfaring som systemeier og behovseier i forberedelse av anskaffelser, kravstiller, deltakelse i konkurransegjennomføring, samt avtaleeier og avtaleforvalter.","Omstilling, endring, ledelse, operasjonalisering av IKT-drift. Ledelse i øvelse og operasjoner i hele cyberdomenet. Risikovurderinger, sikkerhetsvurderinger.",Helsetjenestens driftsorganisasjon for nødnett HF,Helse,2022
Sikkerhetsarkitekt,Virksomhetsarkitektur,"God kompetanse og erfaring med utforming av sikkerhetsarkitektur, informasjonssikkerhet, sikkerhetskonsepter i mikrotjenestebaserte løsninger, kjennskap til moderne plattformer som sky/hybridløsninger, ITIL, PKI-kryptering og elektronisk signering, og ISO 27001/2.","Erfaring med trusselmodellering, smidig/agile metodikk, devOps/devSecOps-prosesser, utvikling av mikro-tjenester, og oppbygging av sikker arkitektur.","God skriftlig og muntlig fremstillingsevne, evne til å ta initiativ og opprette kontakt med andre ressurser innenfor andre fagområder.",Brønnøysundregistrene,Informasjonsteknologi,2022
Sikkerhetsarkitekt,Løsningsarkitektur,"Generell sikkerhetskunnskap, god kjennskap til oppdatert trusselbilde, god kjennskap til sikkerhetsarkitektur, kjennskap til standarder som SABSA eller TOGAF, forståelse for arkitekturmodeller (databasesentriske, distribuerte og microservices), kunnskap innen infrastruktur, utvikling og utviklingsmetodikk, DevOps/DevSecOps, sikker utviklingsmetodikk.",Minst 2-3 års erfaring fra sammenlignbare oppdrag.,Evne til å se helhetsbildet på det tekniske og løsningene.,Digitaliseringsdirektoratet,Offentlig og stat,2022
Rådgiver Kapasitetsstyring,Rådgivning teknisk,"Minimum seniorkonsulent; Erfaring og kompetanse om kapasitetsstyring (menneskelige ressurser); Erfaring fra komplekse IT-organisasjoner; God kompetanse på endringsledelse og kommunikasjon; God prosesskompetanse; Meget god skriftlig og muntlig framstillingsevne i det norske språk; Utdanning på høyskole- eller universitetsnivå, relevant erfaring kan kompensere for utdanningskravet",Erfaring og kompetanse om kapasitetsstyring; Erfaring fra komplekse IT-organisasjoner; Ønskelig kjennskap til virksomhetsstyring og porteføljestyring; Erfaring med Clarity PPM er en fordel; Kjennskap til helsesektorens foretak og virksomhet er en fordel,"Fremoverlent – Ansvarlig – Medspiller; Løsnings- og leveranseorientert; Analytisk, strukturert, handlekraftig; Gode relasjonelle ferdigheter; Manøvrerer godt på ulike organisatoriske nivå; Evner å ha flere baller i luften samtidig; Tenker helhet og ser sammenhenger",Helse Sør-Øst RHF,Helse,2022
Prosjektleder for etablering av NILAR som informasjonstjeneste,Prosjektledelse,Seniorkonsulent med erfaring fra ledelse av større oppdrag i helsesektoren.,Minst 7 års erfaring fra utvikling og innføring av komplekse IT-løsninger i helsesektoren.,Gode kommunikasjonsegenskaper både muntlig og skriftlig. Må beherske norsk språk.,Norsk Helsenett SF,Helse,2022
Avtaleforvaltning og leverandørstyring,Rådgivning teknisk,"Minimum 3 års erfaring fra leverandørstyring og sourcing, erfaring som prosjektleder eller sentral rolle i større teknologianskaffelser.","Dokumentert erfaring innen IT anskaffelser, avtaler, ulike lisensmodeller og skytjenester.","Selvgående, resultatorientert, analytisk, gode kommunikasjonsegenskaper og god på relasjonsbygging.",Helsedirektoratet,Helse,2022
Prosjektleder for STIM endringsledelse,Endringsledelse,"Høyere relevant utdanning på masternivå innen et av områdene IKT, prosjektledelse, organisasjonsutvikling eller endringsledelse. Sertifisering Prince 2, Prince 2 Agile. Erfaring med SCRUM, SAFe, LEAN, Kanban, ITIL4, IT4IT og Prosci Change Management.","Erfaring fra endringsprosesser i større organisasjoner og fra kultur- og organisasjonsutvikling i offentlig sektor. Erfaring med bygging av tverrfaglige team, samt arbeid med tjenestedesign, kundereiser og innovasjonsprosesser.","Evne til å skape begeistring og motivasjon for endringene, utadvendt, analytisk og strukturert. Nysgjerrig, fokus på læring og kontinuerlig forbedring. Evne til raskt å forstå organisasjonen og deres behov, samt bygge sterke relasjoner.",Sykehuspartner,Offentlig og stat,2022
Lede etablering av programkontor,Programledelse,"God kompetanse på målstyring, risikostyring, styringsstrukturer og strategiutvikling på seniornivå. Kompetanse på prosjekt- og programarbeid samt prosjekt/programlederkompetanse.",Omfattende erfaring fra prosjekt- og programarbeid og ledelse. Erfaring med etablering av programkontor og drift.,"Evne å se helheten og samtidig kunne gå ned i detaljer når det trengs. Strukturert, med høy gjennomføringskraft for prosjekter med korte tidsfrister.",Folkehelseinstituttet,Helse,2022
Endringsansvarlig i STIM programmet,Endringsledelse,"Høyere relevant utdanning på masternivå innen et av områdene IKT, endringsledelse, organisasjonsutvikling eller prosjektledelse; Sertifisering Prosci Change Management; Sertifisering Prince 2.","Erfaring fra å lede endringsprosesser i større organisasjoner, erfaring med kultur- og organisasjonsutvikling fra offentlig sektor er en stor fordel, erfaring fra bygging av tverrfaglige team.","Evne til raskt å forstå organisasjonen og deres behov, samt å bygge sterke relasjoner til ledere og nøkkelpersoner på alle nivåer; Evne til å skape begeistring og motivasjon for endringene; Utadvendt, analytisk og strukturert; Nysgjerrig, har fokus på læring, og kontinuerlig forbedring.",Helse Sør-Øst RHF,Helse,2022
Prosjektleder for konseptfase – egenvurderingsverktøy,Prosjektledelse,"Dokumentert erfaring fra digitaliseringsprosjekt; fortrinnsvis med utredningsarbeid for nye systemløsninger og stor grad av brukerorientering. Dokumentert erfaring med Prosjektveiviseren. Kjennskap til offentlig forvaltning, regelverksveiledning, kommunene, den kommunale internkontrollen og forholdet mellom stat og kommune. Kjennskap til kommunes plikter og arbeid etter integreringsloven er en fordel.",Ingrid Anette har de siste fire årene bistått helse- og omsorgssektoren i Oslo kommune som prosjektleder og etter hvert produkteier for utvikling av en digital samhandlingsløsning.,"Evne til å sammenstille og analysere kompleks informasjon. Evne til å samarbeide godt med både fagsiden og ulike beslutningstakere er en forutsetning. Være strukturert og effektiv. Gode kommunikasjonsegenskaper, både skriftlig og muntlig. Gode evner til å samarbeide, planlegge og gjennomføre.",Integrerings- og mangfoldsdirektoratet (IMDi),Offentlig og stat,2022
Seniorrådgiver/ Prosjektstøtte,Prosjektledelse,Minimum utdanning på Bachelor- nivå; Konsulent (minimum 3-5 år); God kunnskap om og erfaring fra området prosjektadministrasjon / prosjektstøtte fra større/ komplekse virksomheter,"Erfaring fra prosjektarbeid i helsesektoren, gjerne med erfaring fra IKT-prosjekter i helsesektoren; Erfaring med gjennomføring av digitale møter og workshops; Erfaring med bruk av Office 365, Sharepoint/projectplace og andre samhandlingsverktøy","Gode kommunikasjonsevner i norsk språk både muntlig og skriftlig; Gode samarbeidsevner med evne til å samarbeide på tvers av fagområder; Analytisk, systematisk, proaktiv og resultatorientert",Helse Sør-Øst RHF,Helse,2022
Seniorrådgiver/ Prosjektstøtte,Prosjektledelse,Minimum utdanning på Bachelor- nivå; Konsulent (minimum 3-5 år); God kunnskap om og erfaring fra området prosjektadministrasjon / prosjektstøtte fra større/ komplekse virksomheter,"Erfaring fra prosjektarbeid i helsesektoren, gjerne med erfaring fra IKT-prosjekter i helsesektoren; Erfaring med gjennomføring av digitale møter og workshops; Erfaring med bruk av Office 365, Sharepoint/projectplace og andre samhandlingsverktøy","Gode kommunikasjonsevner i norsk språk både muntlig og skriftlig; Gode samarbeidsevner med evne til å samarbeide på tvers av fagområder; Analytisk, systematisk, proaktiv og resultatorientert",Helse Sør-Øst RHF,Helse,2022
Prosjektleder - SP - LAB Lukket nett,Prosjektledelse,Senior prosjektleder med minimum 5-7 års erfaring i prosjektledelse. Prince 2 eller PMP-sertifisering. Kjennskap til ITIL prosesser. Erfaring fra IKT-prosjekter. Må beherske norsk skriftlig og muntlig.,Erfaring med å koordinere og levere store komplekse IT-leveranser. Kjennskap til service manager (saksbehandlingsverktøy) og IKT-tjenester innenfor helse. Overordnet forståelse for system og infrastruktur.,"Pådriver og koordinerende, serviceinnstilt og kundeorientert, resultatorientert, selvstendig, gode samarbeids- og kommunikasjonsegenskaper, sterk gjennomføringsevne og høy arbeidskapasitet. Trives i et aktivt miljø.",Helse Sør-Øst RHF,Helse,2022
Prosjektleder for LAB Lukket nett,Prosjektledelse,,,,Sykehuspartner,Helse,2022
Seniorrådgiver for CBDS-sekretariatet,Prosessledelse og fasilitering,"Relevant utdanning på masternivå, innsikt i utvikling av grensekryssende digitale tjenester i Norden og Europa, erfaring med digitaliseringsprosjekter på operativt eller politisk nivå, erfaring med koordinering av nordisk-baltiske og/eller europeiske samarbeidsprosjekter.","Betydelig erfaring med digitaliseringsprosjekter, 20 års erfaring fra offentlig sektor, erfaring fra NAV, Helsedirektoratet og Difi. Erfaring med utarbeidelse av offentlige rapporter og dokumenter, planlegging og gjennomføring av internasjonale samarbeidsmøter.","Evne til å samarbeide godt som en del av et team, raskt sette seg inn i nye problemstillinger, være løsningsorientert, levere med høy kvalitet, kommunisere svært godt på engelsk og norsk, både muntlig og skriftlig.",Digitaliseringsdirektoratet,Offentlig og stat,2022
Virksomhetsarkitekt IAM,Virksomhetsarkitektur,"Konsulentene skal ha minimum 3 års erfaring innenfor IAM-områdene med relevant utdannelse, kurs, sertifisering og referanser fra tilsvarende leveranser.",Erfaring med smidig utvikling og prosjekttilnærming. Erfaring fra tilsvarende oppdrag i helsesektoren og oppdrag i Norsk Helsenett.,Gode kommunikasjonsegenskaper både muntlig og skriftlig på norsk.,Norsk Helsenett SF,Helse,2022
Leder for konseptutredning tilgangsstyring,Prosjektledelse,"Minimum 5-7 års erfaring med tilgangsstyring, god kompetanse på tilgangsstyringsløsninger","Minimum 3-5 års erfaring som prosjektleder, erfaring med konseptutredninger i offentlig sektor",Ingen spesifikke egenskaper nevnt,Integrerings- og mangfoldsdirektoratet (IMDi),Offentlig og stat,2022
Fagkonsulent innen tilgangsstyring,Løsningsarkitektur,"Bred og dyp erfaring innenfor sikkerhet og tilgangsstyring, erfaring med IAM","Flere års erfaring med identitets- og tilgangsstyring, erfaring med konseptutredninger i offentlig sektor",Ingen spesifikke egenskaper nevnt,Integrerings- og mangfoldsdirektoratet (IMDi),Offentlig og stat,2022
