Konsulentrolle,Rollekategori,Kompetansekrav,Erfaringskrav,Konsulentegenskaper,Kundenavn,Bransje,Årstall
Virksomhetsarkitekt - HSØ PO,Virksomhetsarkitektur,"Utdanning som ingeniør/sivilingeniør/master, eller lang relevant erfaring. Dokumenterte kvalifikasjoner innenfor arkitekturpraksis, erfaring fra praktisk virksomhetsarkitektur og bruk av TOGAF som rammeverk, god forretningsforståelse for IKT, erfaring med arkitektur av løsninger med lovpålagte sikkerhetskrav innen helsesektoren, dokumentert erfaring med modellering av virksomhetsarkitektur i verktøy som Archimate, Sparx Enterprise Architect, Bizzdesign.",Erfaring fra store endringsprogrammer i spesialisthelsetjenesten. Erfaring fra å drive og utarbeide komplekse arkitektur- og designprosesser gjennom modellering i henhold til ARCHIMATE/BPMN/UML.,"Meget erfaren og selvstendig, gode samarbeids- og kommunikasjonsferdigheter, strukturert og faglig engasjert, proaktiv, løsningsorientert, nysgjerrig, åpen for utfordringer, god og positiv støttespiller i teamarbeid, selvgående og tar ansvar, gode norskkunnskaper.",Helse Sør-Øst RHF,Helse,2024
Prosessdriver gevinst_forretning SP DPI Praksis og endring,Rådgivning forretning,"Konsulent på minimum seniorkonsulent- nivå, utdannelse på bachelornivå eller tilsvarende, dokumentert erfaring (minimum 12 mnd.) med gevinstrealiseringsarbeid fra større offentlige infrastrukturprosjekter innen helsesektoren, sertifisert i Prince2, beherske norsk språk, både muntlig og skriftlig.","Erfaring med å legge til rette for arbeidsmøter og drive forretningsutviklingsprosesser, erfaring med gevinstrealisering i komplekse virksomheter, god kjennskap til kjernevirksomheten ved helseforetakene i Helse Sør-Øst, erfaring med å utvikle, implementere og følge opp gevinstrealiseringsmetodikk, kompetanse på bruk av prosjektstyringsverktøy som Clarity og MS Project, kompetanse på M365/MSOffice programmer; SharePoint, Teams, Word, Excel, PowerPoint, erfaring med rapportering og bruk av rapporteringsverktøy som Power BI, kjennskap til Difi prosjektveiviseren og Management of portefolio (MoP).","Strukturert og analytisk, stor arbeidskapasitet og driv, gode kommunikasjons- og samarbeidsevner, arbeider godt selvstendig og i tverrfaglige team.",Sykehuspartner,Helse,2024
Arkitekt - alarmvarsling og melding,Løsningsarkitektur,"Minimum 5 års erfaring som løsningsarkitekt for komplekse IKT løsninger i større organisasjoner, arbeidserfaring/kompetanse med strukturert kravspesifisering for IKT løsninger, gjennomføring av anskaffelser av IKT løsninger, ledelse av team.","Erfaring fra konkurranser om leveranse av IKT løsninger med konkurransepreget dialog som anskaffelsesprosedyre, erfaring fra ledelse av strukturerte arbeidsmøter, domenekunnskap om alarm- og meldingsvarsling i helsetjenesten, og erfaring fra store kjøremiljøer.","Ansvarsbevisst, strukturert, med godt motiverende evner.",Sykehuspartner,Helse,2024
Programstøtte for Bo trygt hjemme reformen,Programledelse,"Dokumentert erfaring fra lignende prosjekter, relevante sertifiseringer i prosjekt/programmetodikk",Minimum 5 års erfaring i rollen som prosjekt/programstøtte,Gode kommunikasjonsegenskaper skriftlig og muntlig på norsk,Helsedirektoratet,Helse,2024
Frontend-utvikler for webportal,Utviklingsrolle,"Erfaring med frontend-utvikling, Typescript, React, Tailwind og Astro.build.",Minimum 5 års erfaring med frontend-utvikling og erfaring med Git.,"Gode kommunikasjonsegenskaper på norsk, selvstendig, strukturert, og formidler ideer klart.",Norsk Helsenett SF,Helse,2024
Utvikler for webportal Helse- og KommuneCERT,Utviklingsrolle,Utvikling av selvbetjent kundeportal,Høy faglig standard og profesjonell gjennomføring,"Lojal samarbeid, ivareta kundens interesser",Norsk helsenett SF,Helse,2024
Datavarehusarkitekt for NPE og Helseklage,Løsningsarkitektur,Særlig god erfaring med datavarehus og Power BI som rapporteringsløsning.,"Minimum 2 års erfaring med utvikling av lastejobber (ETL), utvikling av rapporter i Power BI og avansert bruk av SQL.","Gode kommunikasjonsegenskaper, erfaring med behovskartlegging og dialog med behovseiere, og erfaring med etablering av forvaltningsorganisasjon for datavarehusmiljø.",Norsk Pasientskadeerstatning,Helse,2024
Utreder-3.parts vurdering,Rådgivning teknisk,Kunnskap om Cisco IaaC og nettverksmodernisering,Erfaring med nettverksløsninger for helsebransjen,,Sykehuspartner HF,Helse,2024
Utreder,Rådgivning teknisk,Minimum seniorkonsulent. Dokumentert teknisk kompetanse og forståelse for avanserte og moderne nettverksdesign.,Kompetanse fra utredningsarbeider innen helsesektoren. Teknisk kompetanse innen nettverk- og sikkerhetsdesign ved bruk av IaaC. Erfaring med utredningsarbeider. Kompetanse innen prosjektmetodikk og gjennomføring. Dokumentert lang erfaring med utredningsarbeider av komplekse tekniske løsninger der mottaker er ikke tekniske.,Strukturert. Evne til å jobbe selvstendig og levere innen avtalt frist. Evne til å raskt sette seg inn i oppdraget. Meget god samhandlingsevne.,Sykehuspartner,Helse,2024
BI-arkitekt for modernisering av registerplattform,Løsningsarkitektur,"Teknisk ekspertise i skyplattformer, spesielt erfaring med Azure; inngående forståelse for design og utvikling av databaser; erfaring med effektiv lagring og organisering av data i datavarehus; selvstendighet og problemløsning; sterke samarbeids- og kommunikasjonsevner; dybdeforståelse for hvordan teknologiske løsninger kan skape forretningsverdi.","Minst 5 års erfaring med datamodellering, utvikling i SQL, effektiv lagring og organisering av data i datavarehus, og løsningsarkitektur.","Selvstendig, løsningsorientert, teknisk dyktig, kreativ problemløser, engasjert i kontinuerlig læring.",Folkehelseinstituttet,Helse,2024
"Smidig coach - scrum master, SP - RHF - K 1 Metavision Sprinter - Backlog A",Lede agilt team,"Kan dokumentere minst 5 år som scrum master, minst 3 års erfaring i rollen som smidig coach, minimum 2 års erfaring fra opplæring i store og komplekse IKT miljøer. Sertifisert Scrummaster og Smidig coach. Evne til å tilpasse smidige metoder til ulike organisasjonskulturer.",Dokumentert erfaring med å lede tverrfaglige team og fasilitere scrum-seremonier. Hatt ansvar for prosjekter med behov for endringsledelse. Kompetanse innen kontinuerlig forbedring og organisasjonsutvikling.,"Sterke kommunikasjonsevner, både skriftlig og muntlig. Kunne formidle komplekse ideer på en enkel og forståelig måte. Gode samarbeidsevner. Tydelig og inkluderende i sitt samarbeid med forvaltningen. Proaktiv og løsningsorientert.",Sykehuspartner,Helse,2024
Smidig coach,Lede agilt team,Ingen spesifikke krav oppgitt,Ingen spesifikke krav oppgitt,Ingen spesifikke egenskaper oppgitt,Sykehuspartner,Helse,2024
"Scrum master, SP - Automasjon og orkestrering",Lede agilt team,"Sertifisert Scrum master eller Prince 2 Agile. Erfaring med smidig metode i teknologinære prosjekter, erfaring med å jobbe i tverrfaglige team, erfaring fra store, komplekse organisasjoner, god teknisk forståelse for IKT infrastruktur.","Minimum 3 års dokumentert erfaring som scrum master, minimum 3 års dokumentert erfaring med innføringsprosjekter i store og komplekse IKT miljøer, erfaring med kontinuerlige leveranser i et smidig prosjektmiljø.","Gode samarbeidsevner, evne til å jobbe strukturert, stor kapasitet til å se løsninger, evne til å jobbe selvstendig og i team, initiativrik, løsningsorientert, drivende, kvalitetsbevisst, ryddig og strukturert, gode kommunikasjonsevner.",Sykehuspartner,Helse,2024
Prosjektleder Ahus Regional radiologi 2.0,Prosjektledelse,"Må-ha krav: Konsulenten må kunne vise til og dokumentere prosjekterfaring fra helseprosjekter, med roller som prosjektleder eller delprosjektleder. Konsulenten må ha grunnleggende forretningsmessig forståelse for arbeidsprosesser innen sykehus og spesialisthelsetjenesten. Konsulenten må kunne vise til å ha ledet prosjekter med flere interessenter, faggrupper og leverandører. Konsulenten må kunne kommunisere godt på skandinavisk, skriftlig og muntlig.","Erfaring og kjennskap til spesialitetsfeltet radiologi, Ervaring med radiologløsning levert fra Sectra, Erfaring med integrasjoner, Erfaring med test og defecthåndtering, Erfaring med migrering, Kjennskap til Sykehuspartner, Prosjekterfaring med prosjektmetodikk som benyttes i Helse Sør-Øst.","Gode samarbeids- og gjennomføringsevner, god prosessdriver, strukturert, trygg og en samlende lagbygger.",Akershus universitetssykehus HF,Helse,2024
Prosess- og lederstøtte til oppdragsledelsen i PLL,Prosessledelse og fasilitering,"Relevante kompetanser innen utarbeidelse og forvaltning av planer, styrende dokumenter, usikkerhet- og risikomatriser, rapportering.",Erfaring med arbeid fra IKT-prosjekter i offentlig sektor eller store og komplekse virksomheter.,"Initiativrik, selvstendig, strukturert og ryddig.",Helsedirektoratet,Helse,2024
Prosess- og lederstøtte til oppdragsledelsen i PLL,Prosessledelse og fasilitering,"Relevante kompetanser innen utarbeidelse og forvaltning av planer, styrende dokumenter, usikkerhet- og risikomatriser, rapportering.",Erfaring med arbeid fra IKT-prosjekter i offentlig sektor eller store og komplekse virksomheter.,"Initiativrik, selvstendig, strukturert og ryddig.",Helsedirektoratet,Helse,2024
Prosess- og lederstøtte til oppdragsledelsen i PLL,Prosessledelse og fasilitering,"Relevante kompetanser innen utarbeidelse og forvaltning av planer, styrende dokumenter, usikkerhet- og risikomatriser, rapportering.",Erfaring med arbeid fra IKT-prosjekter i offentlig sektor eller store og komplekse virksomheter.,"Initiativrik, selvstendig, strukturert og ryddig.",Helsedirektoratet,Helse,2024
Testressurs,Test og kvalitetsikring,"Minimum 3 års erfaring, Dokumentert erfaring fra test av komplekse systemløsninger med ulike integrasjoner, Dokumentert erfaring fra store prosjekter som krever koordinering på tvers av systemer og miljøer, Dokumentert erfaring med systemkonfigurasjon, Kjennskap til Ascom løsninger, Utarbeide testtilfeller for tilpassede tredjepartsløsninger, Erfaring fra både funksjonell og teknisk testing, Bruk av verktøyet ALM for testoppfølging, Test via tekniske grensesnitt som Postman e., Relevante sertifiseringer (ISQTB Foundation/ISQTB Test Analyst e.l.)","Minimum 3 års erfaring, Dokumentert erfaring fra test av komplekse systemløsninger med ulike integrasjoner, Dokumentert erfaring fra store prosjekter som krever koordinering på tvers av systemer og miljøer, Dokumentert erfaring med systemkonfigurasjon","God teknisk forståelse, Selvstendig og flink til å samarbeide, Positiv og løsningsorientert",Sykehuspartner,Helse,2024
Teknisk ressurs til systemkonfigurasjon,Løsningsarkitektur,"Minimum 3 års erfaring, Dokumentert erfaring fra test av komplekse systemløsninger med ulike integrasjoner, Dokumentert erfaring fra store prosjekter som krever koordinering på tvers av systemer og miljøer, Dokumentert erfaring med systemkonfigurasjon, Kjennskap til Ascom løsninger, Utarbeide testtilfeller for tilpassede tredjepartsløsninger, Erfaring fra både funksjonell og teknisk testing, Bruk av verktøyet ALM for testoppfølging, Test via tekniske grensesnitt som Postman e., Relevante sertifiseringer (ISQTB Foundation/ISQTB Test Analyst e.l.)","Minimum 3 års erfaring, Dokumentert erfaring fra test av komplekse systemløsninger med ulike integrasjoner, Dokumentert erfaring fra store prosjekter som krever koordinering på tvers av systemer og miljøer, Dokumentert erfaring med systemkonfigurasjon","God teknisk forståelse, Selvstendig og flink til å samarbeide, Positiv og løsningsorientert",Sykehuspartner,Helse,2024
Seniorkonsulent innen organisasjonsutvikling og endringsledelse,Endringsledelse,"Organisasjonsutvikling, endringsledelse, arbeidsmiljø",,,Folkehelseinstituttet,Helse,ukjent
Seniorkonsulent innen organisasjonsutvikling og endringsledelse,Endringsledelse,"Relevant utdannelse innen samfunnsfag, styring og organisasjon, helst på ph.d.-nivå. Dokumentert kompetanse på organisasjons- og rutineutvikling, endringsledelse, virksomhetsstyring, organisasjonsutvikling, kompetansekartlegging, lederstøtte og -utvikling, samt arbeidsmiljø i komplekse og kunnskapsintensive virksomheter.","Lang erfaring fra offentlig sektor knyttet til prosjektorganisering, ledelse, prosessbistand og utredninger/analyser, samt erfaring fra politiske sektorer hvor grenseflaten mellom faglig integritet, frihet, forvaltning og individualitet er rammesettende.","Åpen, erfaren, flink og rask til å sette seg inn i problemstillinger for å finne endringer og forbedringsforslag i samarbeid med ledere og medarbeidere.",Folkehelseinstituttet,Helse,2024
"Teknisk delprosjektleder, gjennomføringsansvarlig Datasenter",Prosjektledelse,"Erfaring på rådgivernivå (minst 4 år), Min 3 års dokumentert erfaring som teknisk prosjektleder eller koordinerende rolle i mellomstore til store prosjekter, Dokumentert erfaring fra lignende prosjekter innen kompleks IKT infrastruktur, dataromsforvaltning og datamodellering, må beherske engelsk skriftlig og muntlig","Erfaring med mellomstore til store prosjekter, gjerne i offentlig sektor, Erfaring fra prosjekter innenfor helsesektoren er en fordel","Initiativrik og løsningsorientert, Erfaring med å håndtere mange interessenter, Engasjert og fremoverlent",Sykehuspartner,Helse,2024
Personvernombud for kontrollkommisjonene,Rådgivning teknisk,"Konsulenten skal være jurist og ha erfaring som personvernombud eller fra rådgivning i saker om personvern, samt god kjennskap til helsesektorens organisering og regelverk.",Minimum 5 års erfaring som personvernombud eller fra rådgivning i saker om personvern. Erfaring med personvernlovgivningen og regelverk.,Gode kommunikasjonsegenskaper både muntlig og skriftlig på norsk.,Helsedirektoratet,Helse,2024
Scrum master for Helsenorge,Lede agilt team,Konsulenten må ha minimum 2 års erfaring med teamutvikling og produkt- eller utviklingsteam samt gode kommunikasjonsegenskaper på norsk.,"Konsulenten må ha 8+ års erfaring, hvorav erfaring med smidige metodikker som Scrum.","Engasjert, nysgjerrig, åpen, flink med mennesker, interessert i prosesser og endrings-/relasjonsledelse.",Norsk Helsenett SF,Helse,2024
Områdeleder IKT,Prosjektledelse,"Utdanning som ingeniør/sivilingeniør/master. Kandidater uten formell utdannelse men med lang relevant erfaring kan også komme i betraktning. Konsulenter må ha kvalifikasjoner innenfor lang erfaring innen prosjekt/programledelse i komplekse miljøer med sertifiseringer som Prince2®, MSP®, PMI PMP, bør ha økonomisk forståelse og erfaring fra anskaffelses- og evalueringsaktiviteter, solid erfaring fra prosjekter i offentlig sektor, og erfaring med bruk av angitte verktøy.",Solid erfaring fra prosjekter i offentlig sektor og lang erfaring innen prosjekt/programledelse i komplekse miljøer.,"Erfaren og selvstendig konsulent med gode samarbeids- og kommunikasjonsferdigheter, strukturert, faglig engasjert, proaktiv, løsningsorientert, nysgjerrig, selvgående, gode norskkunnskaper, tar ledelse i komplekse problemstillinger.",Sykehusbygg HF,Helse,2024
Fullstack utvikler,Utviklingsrolle,"Spesielt god kompetanse på og erfaring med .NET 8.0 eller tidligere versjoner av rammeverket og databaseteknologi, samt integrasjonsutvikling.","Minimum 3 års erfaring med .NET rammeverk, inkludert .NET Core, ASP.NET og .NET Framework. Minimum 3 års erfaring med Databaseteknologi (MSSQL Server og/eller MongoDB). Minimum 3 års erfaring med Frontend-utvikling etter moderne web standarder (web components). Minimum 3 års erfaring med skyteknologi, helst Azure. Minimum 3 års erfaring med DevOps of CI/CD, inkludert automatiserte pipelines og verktøy som Octopus Deploy, TeamCity og Azure DevOps. Minimum 3 års erfaring med relasjonsdatabaser og utvikling med SQL. Minimum 2 års erfaring fra statlige virksomheter.",Gode kommunikasjonsegenskaper både muntlig og skriftlig på norsk og engelsk.,Statens helsetilsyn,Helse,2024
"Prosessledelse, porteføljestyring og støtte til ledelsen i Helsetilsynet",Prosessledelse og fasilitering,"Dokumentert erfaring med program- og porteføljestyring, prosjektledelse, prosessledelse, strategisk ledelse og etablering av virksomhetsarkitektur, med sertifisering i relevante metoder.","Minimum 5 års erfaring med program- porteføljestyring, strategisk ledelse og helsesektoren i offentlig sektor samt arbeid med virksomhetsarkitektur.","Selvgående, strukturert, produktiv, med god teknisk og strategisk innsikt, løsningsorientert, med evne til å sikre forankring.",Statens helsetilsyn,Helse,2024
Prosessledelse og porteføljestyring,Prosessledelse og fasilitering,"Konsulenten skal levere bistand i samsvar med avtalen, på en faglig forsvarlig og profesjonell måte, og i overensstemmelse med anerkjente metoder og standarder.",,"Konsulenten skal lojalt samarbeide med Kunden, og ivareta Kundens interesser.",Statens helsetilsyn,Helse,2024
Støtte til ledelsen,Rådgivning forretning,"Konsulenten skal levere bistand i samsvar med avtalen, på en faglig forsvarlig og profesjonell måte, og i overensstemmelse med anerkjente metoder og standarder.",,"Konsulenten skal lojalt samarbeide med Kunden, og ivareta Kundens interesser.",Statens helsetilsyn,Helse,2024
"Teknisk prosessleder, gjennomføringsansvarlig",Prosessledelse og fasilitering,"Erfaring på rådgivernivå (minst 4 år), Min. 3 års erfaring med prosess- og/eller prosjektledelse eller koordinerende rolle i mellomstore til store prosjekter, Erfaring fra lignende prosjekter innen kompleks IKT infrastruktur, dataromsforvaltning og datamodellering, Må beherske norsk og engelsk skriftlig og muntlig","Erfaring fra prosjekter innenfor helsesektoren er en fordel, Erfaring med smidig metodikk (Scrum), Erfaring med kommunikasjon med ulike interessenter, Erfaring med risikohåndtering og endringsarbeid i mellomstore til store prosjekter, gjerne i offentlig sektor","Engasjert og fremoverlent, Initiativrik og løsningsorientert, Evne til å motivere og engasjere teammedlemmer, Gode kommunikasjonsevner både skriftlig og muntlig",Sykehuspartner,Helse,2024
Prosjektmedarbeider til Radikale innovasjoner,Prosjektledelse,"Egnethet samt utdanning, kompetanse og relevant erfaring innen selvkjøring, norsk arbeidsspråk min. C1, engelsk min. B2, dokumentasjon, effektiv samhandling, erfaring i prosjektplaner og milepæler, kjennskap til samferdselssektoren.",Minst 1 år relevant erfaring som prosjektleder.,"Gode kommunikasjons- og samarbeidsevner, høy gjennomføringskraft, motivasjon, lagspiller, nysgjerrig, interessert i å lage gode tjenester.",Ruter AS,Offentlig og stat,2024
Prosessleder for godkjenningsordning helseteknologi,Prosessledelse og fasilitering,"Erfaring med prosessledelse, kravprofiler, verifisering/test for anskaffelser av helseteknologier, erfaring med leverandørindustrien og aktørnettverk.","Dokumentert erfaring fra prosessledelse, arbeid med krav, krav verifisering og kravforvaltning, minst 3 års erfaring i arbeid med helseteknologi.","God muntlig og skriftlig fremstillingsevne, strukturert, trives med å jobbe i team, god relasjonsbygger.",Helsedirektoratet,Helse,2024
Utvikler til Helsenorge,Utviklingsrolle,"Minimum 5 års erfaring med utvikling i Microsoft Azure, 1 års erfaring med .NET, ASP.NET Core, .NET 8, C#, REST, og containerteknologi. Grunnleggende erfaring og kompetanse innen sikkerhet og personvern.","Dokumentert erfaring med Microsoft Azure, containerbaserte applikasjoner i Azure-miljøer, integrering av Azure-tjenester, RabbitMQ, Redis, SQL Server, og erfaring fra prosjekter som OBOS, ICE Mobil, og Statens Legemiddelverk.","Gode kommunikasjonsegenskaper både muntlig og skriftlig, beherske norsk språk.",Norsk Helsenett SF,Helse,2024
Prosessleder for bistand til EHDS konsekvensvurdering,Prosessledelse og fasilitering,"Minimum 5 års erfaring fra prosessledelse, god forståelse for helsesektoren og offentlig forvaltning, svært gode kommunikasjonsegenskaper på norsk og engelsk, god erfaring med kontorstøtteverktøy, erfaring fra utredninger og rapportskriving, relevant utdanning på universitets-/høyskolenivå","Proaktiv, sterk på planlegging, kan holde struktur og oversikt, kan utforme enkle kommuniserbare budskap, forventes å bidra i produksjon og oppfølging, må ha internasjonal erfaring og erfaring med helsedigitalisering","Strukturert, strategisk, evne til å håndtere og sammenfatte komplekse problemstillinger, trives med å jobbe i team, god relasjonsbygger",Helsedirektoratet,Helse,2024
Prosessleder for bistand til EHDS konsekvensvurdering,Prosessledelse og fasilitering,,,,Helsedirektoratet,Helse,2024
Systemutvikler til team plattform,Utviklingsrolle,".NET Core, Golang, REST-basert API, Kubernetes, Kubernetes operatorer, støttekomponenter for sikkerhet, CI/CD","Minimum 3 års erfaring med .NET Core, Golang, Kubernetes som orkestreringsplattform, Kubernetes operatorer. Minimum 4 års erfaring med utvikling av REST-basert API, utvikling i team basert på smidige prinsipper",Gode kommunikasjonsegenskaper både muntlig og skriftlig på norsk og engelsk,Norsk Helsenett SF,Helse,2024
Systemutvikler til team plattform,Utviklingsrolle,,,,Norsk Helsenett SF,Helse,ukjent
Domenearkitekt - Prosjekt OT Osloprosjektene,Løsningsarkitektur,"Kompetanse innen IT arkitektur tilsvarende spesialistnivå, erfaring med tekniske arkitekturområder, integrasjoner av komplekse systemer, og strategisk sikkerhet for operasjonell teknologi.","Erfaring rettet mot kritiske systemer i operasjonell kontekst (OT) og digitalisering i helsevesenet, med minst 8 års erfaring på spesialistnivå.","Kommunikasjonsevner, trustskapende, strukturert og analytisk, gjennomføringsevne.",Sykehuspartner,Helse,2024
Domenearkitekt - Prosjekt OT - Osloprosjektene,Løsningsarkitektur,"Utforme målbilde og arkitekturbeskrivelser for operasjonell teknologi i helseregionen. Interessentanalyser, behovsanalyse, målarkitekturer, veikart, usikkerhetsanalyse / risiko.","Prosjektleveranser innen arkitekturområdet (målarkitekturer, forretningsplaner, analyser) og bistå i forankringsarbeid.",,Sykehuspartner,Helse,2024
Utvikler for team Innbyggers legemidler,Utviklingsrolle,"God kompetanse på og minimum 3 års dokumentert relevant erfaring med Java, erfaring med Docker kontainere og Kubernetes orkestreringsplattform, erfaring med hendelsesorientert arkitektur og køsystemer, erfaring med utvikling av REST-baserte API, gode kommunikasjons¬egenskaper på norsk og engelsk, grunnleggende erfaring og kompetanse innen sikkerhet og personvern, erfaring med utvikling i team basert på smidige prinsipper.",Konsulent (3-7 års erfaring) eller Seniorkonsulent (8+ års erfaring),"Flink med mennesker, engasjert og nysgjerrig, åpen, liker å samarbeide med andre, interessert i prosesser og trives med teamarbeid.",Norsk Helsenett SF,Helse,2024
Utvikler for team Innbyggers legemidler,Utviklingsrolle,,,,Norsk Helsenett SF,Helse,ukjent
Prosjektleder IKT Fagteam,Prosjektledelse,"Utdanning som ingeniør/sivilingeniør/master. Lang erfaring innen prosjekt/programledelse i komplekse miljøer. Riktig kandidat bør ha sertifiseringer som understøtter dette, som for eksempel Prince2®, MSP®, PMI PMP eller andre relevante sertifiseringer. Erfaring og forståelse for kliniske og administrative fagområder i spesialisthelsetjenesten. Dokumentert erfaring vedrørende kommunikasjon og samarbeide med involverte organisasjoner, og relasjonsbygging mot sponsorer og interessenter.","Solid erfaring fra prosjekter i helsesektor/spesialisthelsetjeneste, økonomisk forståelse og erfaring fra anskaffelses- og evalueringsaktiviteter, samt erfaring fra og bruk av angitte verktøy i sykehusprosjekter, er en fordel.","Rollen krever en meget erfaren og selvstendig konsulent som brenner for oppgaven. God samarbeids- og kommunikasjonsferdigheter, strukturert og faglig engasjert, proaktiv, løsningsorientert og nysgjerrig. Åpen for utfordringer og er en god og positiv støttespiller i teamarbeid. Selvgående og tar ansvar. Gode norskkunnskaper – både skriftlig og muntlig. Vant til å ta ledelse i komplekse problemstillinger som involverer mange interessenter med forskjellig bakgrunn.",Sykehusbygg HF,Helse,2024
Senior prosessdriver for EPJ-løftet,Prosjektledelse,"Må ha relevant utdannelse på masternivå, dokumentert kompetanse og erfaring fra tilsvarende arbeid; sertifisering i relevante metodikker.","Minimum 8 års erfaring, dokumentert erfaring som prosjektleder, erfaring med prosessledelse, god innsikt i helsesektoren, forståelse for offentlige anskaffelser.","Personlig egnethet, erfaring med utarbeidelse av saksunderlag og kravspesifikasjoner.",Helsedirektoratet,Helse,2024
Spesialrådgiver - Videreutvikling av CCoE,Rådgivning teknisk,"Minimum 10 års erfaring med digitaliserings- og omstillingsarbeid i offentlig sektor, Betydelig erfaring med å rådgi og veilede ledere i omstillingsarbeid, Erfaring med å utarbeide skystrategi","Erfaring med virksomhetsutvikling i offentlig sektor for å ta i bruk sky, fortrinnsvis i helsevesenet","Selvstendig og proaktiv profil, Systematisk og strukturert arbeidsform",Sykehuspartner,Helse,2024
IKT-rådgiver/prosjektstøtte,Rådgivning teknisk,"Høyere teknisk relevant utdannelse, erfaring med fremdriftsplanlegging og rapportering, dokumentstyring, Omega 365","Erfaring med lignende rolle i helsevesenet, erfaring med prosjektledelse, byggeprosjekter og nye sykehusbygg","Evne til å arbeide strukturert, systematisk og selvstendig, gode skriftlige og muntlige fremstillingsevner",Sykehuspartner,Helse,2024
